{
  "schemaVersion": "wealth-facts.v0.1",
  "subject": {
    "namespace": "fixture-bank",
    "id": "customer-001"
  },
  "assets": {
    "availability": "AVAILABLE",
    "amounts": [
      {
        "money": {
          "value": "1000000.12345678",
          "currency": "CNY"
        },
        "scope": "FIXTURE_BANK_ASSETS",
        "valuationAt": "2026-09-01T00:00:00Z"
      }
    ],
    "missingSources": []
  },
  "risk": {
    "availability": "AVAILABLE",
    "level": "C3",
    "scheme": "fixture-risk-scale",
    "assessmentVersion": "assessment-2",
    "expiresOn": "2027-03-01",
    "dateZone": "Asia/Shanghai"
  },
  "gaps": [],
  "source": {
    "reference": "fixture-bank",
    "contract": "fixture:wealth-source-v1",
    "semanticsBasis": "fixture:dictionary-v1",
    "kind": "CONTROLLED_FIXTURE",
    "observedAt": "2026-09-05T00:00:00Z",
    "payloadSha256": "aaaaaaaaaaaaaaaaaaaaaaaaaaaaaaaaaaaaaaaaaaaaaaaaaaaaaaaaaaaaaaaa"
  }
}
